,command,intent
318,включение устройство мотор идти на восток,корабль вправо
319,идти работа устройство врубать мотор идти на восток,корабль вправо
320,на мотор идти врубать восток,корабль вправо
321,врубать мотор восток на идти,корабль вправо
322,большой корабль корабль направо,корабль вправо
323,корабль большой корабль направо,корабль вправо
324,направо корабль,корабль вправо
325,пилотировать летательный аппарат направо,корабль вправо
326,корабль направо,корабль вправо
327,я идти идти работа устройство корабль направо,корабль вправо
328,я произойти случиться корабль направо,корабль вправо
329,я направо корабль идти,корабль вправо
330,я идти корабль большой корабль направо,корабль вправо
331,я большой корабль идти корабль направо,корабль вправо
332,я идти корабль направо,корабль вправо
333,я ехать двигаться о средство передвижение корабль направо,корабль вправо
334,я посетить прийти побывать корабль направо,корабль вправо
335,корабль идти я направо,корабль вправо
336,идти я корабль направо,корабль вправо
337,корабль на клетка большой корабль вправо,корабль вправо
338,большой корабль на клетка вправо,корабль вправо
339,вправо на клетка корабль,корабль вправо
340,корабль на клетка вправо,корабль вправо
341,корабль на большой корабль клетка вправо,корабль вправо
342,корабль на клетка для животное вправо,корабль вправо
343,корабль на вправо клетка,корабль вправо
344,корабль клетка узор на клетка вправо,корабль вправо
345,шаг правый большой корабль корабль,корабль вправо
346,невиновность шаг правый корабль,корабль вправо
347,шаг корабль правый,корабль вправо
348,этап процесс правый корабль,корабль вправо
349,шаг невиновность правый корабль,корабль вправо
350,корабль правый шаг,корабль вправо
351,шаг правый корабль,корабль вправо
352,правый рулевой,корабль вправо
353,правый руль рулевой,корабль вправо
354,невиновность правый рулевой,корабль вправо
355,правый рулевой на судно,корабль вправо
356,правый невиновность рулевой,корабль вправо
357,правый руль,корабль вправо
358,рулевой правый,корабль вправо
359,поплыть я на корабль направо,корабль вправо
360,я поплыть на большой корабль корабль направо,корабль вправо
361,я плыть на судно на корабль направо,корабль вправо
362,на поплыть я корабль направо,корабль вправо
363,я поплыть на корабль направо,корабль вправо
364,я плыть передвигаться по вода на корабль направо,корабль вправо
365,большой корабль я поплыть на корабль направо,корабль вправо
366,я большой корабль поплыть на корабль направо,корабль вправо
367,отплывать отплыть отправиться в плавание вправо,корабль вправо
368,отплыть отправиться в плавание вправо,корабль вправо
369,отплывать вправо,корабль вправо
370,вправо отплывать,корабль вправо
371,направо поплыть мы,корабль вправо
372,мы поплыть плавный движение направо,корабль вправо
373,мы плыть на судно направо,корабль вправо
374,поплыть мы направо,корабль вправо
375,мы плыть передвигаться по вода направо,корабль вправо
376,мы плавный движение поплыть направо,корабль вправо
377,плавный движение мы поплыть направо,корабль вправо
378,мы направо поплыть,корабль вправо
379,мы поплыть направо,корабль вправо
380,завести механизм устройство мотор мы ехать на восток,корабль вправо
381,заводить мотор восток ехать на мы,корабль вправо
382,двигатель заводить мотор мы ехать на восток,корабль вправо
383,заводить мотор мы ехать на восток макрорегион,корабль вправо
384,заводить мотор мы ехать на восток,корабль вправо
385,заводить мотор на ехать мы восток,корабль вправо
386,заводить восток мотор мы ехать на восток,корабль вправо
387,ввести привести заводить мотор мы ехать на восток,корабль вправо
388,от направо шаг корабль,корабль вправо
389,звук шаг шаг направо от корабль,корабль вправо
390,шаг направо большой корабль от корабль,корабль вправо
391,шаг направо от пилотировать летательный аппарат,корабль вправо
392,шаг направо звук шаг от корабль,корабль вправо
393,шаг направо от большой корабль,корабль вправо
394,шаг от направо корабль,корабль вправо
395,шаг направо от корабль,корабль вправо
396,корабль двигаться на я направо,корабль вправо
397,я двигаться на корабль направо,корабль вправо
398,я большой корабль двигаться на корабль направо,корабль вправо
399,я шевелиться изменять положение тело двигаться на корабль направо,корабль вправо
400,я двигаться направо корабль на,корабль вправо
401,на двигаться я корабль направо,корабль вправо
402,я движение перемещение на корабль направо,корабль вправо
403,я двигаться большой корабль на корабль направо,корабль вправо
404,я двигаться на большой корабль направо,корабль вправо
405,бортовый стенка по правый борт,корабль вправо
406,по правый невиновность борт,корабль вправо
407,по правый борт одежда,корабль вправо
408,по правый бортовый стенка,корабль вправо
409,по правый борт,корабль вправо
410,по борт правый,корабль вправо
411,по правый бортовый стенка борт,корабль вправо
412,с корабль по невиновность правый борт,корабль вправо
413,по корабль с правый борт,корабль вправо
414,с невиновность корабль по правый борт,корабль вправо
415,с пилотировать летательный аппарат по правый борт,корабль вправо
416,корабль с по правый борт,корабль вправо
417,с корабль по правый бортовый стенка борт,корабль вправо
418,с корабль по правый борт,корабль вправо
419,с борт по правый корабль,корабль вправо
420,большой корабль направо,корабль вправо
421,на борт правый летательный аппарат,корабль вправо
422,на борт правый борт,корабль вправо
423,на правый борт борт,корабль вправо
424,на бортовый стенка борт правый борт,корабль вправо
425,на борт правый бортовый стенка борт,корабль вправо
426,на борт правый водный средство транспорт,корабль вправо
427,бортовый стенка на борт правый борт,корабль вправо
428,на борт правый борт одежда,корабль вправо
429,борт на правый борт,корабль вправо
430,опереться на иметься направо,корабль вправо
431,опереться на иметься отправляться направо,корабль вправо
432,направо отправляться,корабль вправо
433,отправляться направо,корабль вправо
434,повернуть большой корабль корабль направо,корабль вправо
435,повернуть при движение корабль направо,корабль вправо
436,корабль повернуть направо,корабль вправо
437,повернуть изменить положение корабль направо,корабль вправо
438,направо корабль повернуть,корабль вправо
439,повернуть корабль большой корабль направо,корабль вправо
440,повернуть пилотировать летательный аппарат направо,корабль вправо
441,повернуть корабль направо,корабль вправо
442,не знаю что делать,ничего
443,или что тут писать,ничего
444,тяжело,ничего
445,ты не прав,ничего
446,она права насчет этого,ничего
447,это мое право,ничего
448,по правде говоря корабли не летают,ничего
449,люблю чебуреки,ничего
450,что про лево то сказать,ничего
451,левшей меньше чем правшей,ничего
452,знаешь мем про лев и прав,ничего
453,как судак и тудак,ничего
454,хочу морепродуктов,ничего
455,Мне нравятся осколки.,ничего
456,"Правда в том, что корабль не летает.",ничего
457,Левша меньше правого.,ничего
458,Или что написать.,ничего
459,Я хочу морепродукты.,ничего
460,"Я не знаю, что делать.",ничего
461,Ты ошибаешься.,ничего
462,Это мое право.,ничего
463,"Я не знаю, что сказать про льва.",ничего
464,Как ветчина и лопата,ничего
465,"Ты знаешь, каково это - быть правым.",ничего
466,Это тяжело.,ничего
467,Он прав.,ничего
468,что знать не делать,ничего
469,не знать что изготовить выработать,ничего
470,не знать знать обладать познание что делать,ничего
471,не знать делать что,ничего
472,не аристократия социальный слой что делать,ничего
473,не знать что действие целенаправленный действие,ничего
474,не знать обладать познание знать что делать,ничего
475,не знать что делать,ничего
476,или что тут писать послать письмо,ничего
477,что или тут писать,ничего
478,или что тут писать сочинять текст,ничего
479,или что мочевыделение тут писать,ничего
480,или что тут писать изображать графический знак,ничего
481,или тут что писать,ничего
482,или что тут мочевыделение писать,ничего
483,правовой система ты не право,ничего
484,право не ты,ничего
485,ты не правовой система право,ничего
486,ты не право,ничего
487,ты право не,ничего
488,она право насчёт это,ничего
489,она право это насчёт,ничего
490,право она насчёт это,ничего
491,она право насчёт правовой система это,ничего
492,правовой система она право насчёт это,ничего
493,она правовой система право насчёт это,ничего
494,это мой право,ничего
495,это правовой система мой право,ничего
496,правовой система это мой право,ничего
497,мой это право,ничего
498,это право мой,ничего
499,по правда говорить корабль не лететь передвигаться,ничего
500,не правда говорить корабль по летать,ничего
501,по правда высказать корабль не летать,ничего
502,по правда говорить корабль не лететь передвигаться летать,ничего
503,по правда говорить большой корабль не летать,ничего
504,по правда говорить корабль не летать,ничего
505,большой корабль по правда говорить корабль не летать,ничего
506,по правда большой корабль говорить корабль не летать,ничего
507,по правда летать корабль не говорить,ничего
508,говорить правда по корабль не летать,ничего
509,чебурек любить чебурек,ничего
510,любить чебурек,ничего
511,любить нуждаться в условие любить чебурек,ничего
512,любить нуждаться в условие чебурек,ничего
513,чебурек любить,ничего
514,любить чебурек чебурек,ничего
515,нравиться чебурек,ничего
516,что про левый то сказать,ничего
517,что про левый сторона то сказать,ничего
518,про что левый то сказать,ничего
519,что левый сторона про левый то сказать,ничего
520,то про левый что сказать,ничего
521,что то левый про сказать,ничего
522,что про левый то высказать,ничего
523,что высказать про левый то сказать,ничего
524,левый сторона что про левый то сказать,ничего
525,левша маленький чем правша,ничего
526,левша маленький правша чем,ничего
527,левша маленький чем правша правша,ничего
528,левша чем маленький правша,ничего
529,левша искусный мастер маленький чем правша,ничего
530,левша левша маленький чем правша,ничего
531,левша маленький правша чем правша,ничего
532,левша правша чем маленький,ничего
533,знать обладать познание мем про лев и право,ничего
534,аристократия социальный слой мем про лев и право,ничего
535,знать мем про знать обладать познание лев и право,ничего
536,знать мем про право и лев,ничего
537,знать мем про лев и право,ничего
538,знать знать обладать познание мем про лев и право,ничего
539,знать обладать познание знать мем про лев и право,ничего
540,про мем знать лев и право,ничего
541,знать мем про и лев право,ничего
542,как и судак тудак,ничего
543,как судак и судак тудак,ничего
544,как тудак и судак,ничего
545,как судак судак и тудак,ничего
546,хотеть морепродукт,ничего
547,хотеть иметь желание морепродукт,ничего
548,вожделеть испытывать чувственный влечение хотеть морепродукт,ничего
549,вожделеть испытывать чувственный влечение морепродукт,ничего
550,хотеть вожделеть испытывать чувственный влечение морепродукт,ничего
551,морепродукт хотеть,ничего
552,я осколок прошлое нравиться осколок,ничего
553,я осколок нравиться,ничего
554,я нравиться осколок,ничего
555,я нравиться осколок отколоться кусок,ничего
556,я нравиться нравиться осколок,ничего
557,осколок нравиться я,ничего
558,правда в тот что большой корабль корабль не летать,ничего
559,правда в тот корабль что не летать,ничего
560,правда в тот что корабль большой корабль не летать,ничего
561,правда в тот что пилотировать летательный аппарат не летать,ничего
562,правда в что тот корабль не летать,ничего
563,корабль в тот что правда не летать,ничего
564,правда в тот что корабль не летать,ничего
565,правда в тот что корабль не лететь передвигаться,ничего
566,левша небольшой малый правый,ничего
567,невиновность левша маленький правый,ничего
568,левша малозначительный незначительный правый,ничего
569,малозначительный незначительный левша маленький правый,ничего
570,правый маленький левша,ничего
571,левша маленький правый,ничего
572,левша искусный мастер маленький правый,ничего
573,написать что или,ничего
574,или что написать,ничего
575,или писать картина что написать,ничего
576,писать картина или что написать,ничего
577,или что писать изображать графический знак,ничего
578,что или написать,ничего
579,я вожделеть испытывать чувственный влечение морепродукт,ничего
580,я вожделеть испытывать чувственный влечение хотеть морепродукт,ничего
581,я хотеть вожделеть испытывать чувственный влечение морепродукт,ничего
582,я хотеть иметь желание морепродукт,ничего
583,хотеть я морепродукт,ничего
584,я хотеть морепродукт,ничего
585,морепродукт хотеть я,ничего
586,вожделеть испытывать чувственный влечение я хотеть морепродукт,ничего
587,я что знать не делать,ничего
588,не я знать что делать,ничего
589,я действие целенаправленный действие не знать что делать,ничего
590,я не знать что делать,ничего
591,я не знать обладать познание что делать,ничего
592,я не знать что изготовить выработать,ничего
593,я не действие целенаправленный действие знать что делать,ничего
594,я не знать обладать познание знать что делать,ничего
595,что не знать я делать,ничего
596,ты ошибаться,ничего
597,ошибаться ты,ничего
598,ошибиться ты ошибаться,ничего
599,ты ошибиться ошибаться,ничего
600,ты ошибиться,ничего
601,право мой это,ничего
602,я что знать не сказать про лев,ничего
603,я не знать что сказать про лев,ничего
604,я не лев животное знать что сказать про лев,ничего
605,я не знать что про сказать лев,ничего
606,я не что знать сказать про лев,ничего
607,я не знать что сказать про лев животное,ничего
608,я не знать обладать познание что сказать про лев,ничего
609,я не знать что сказать про знать обладать познание лев,ничего
610,и ветчина как лопата,ничего
611,лопата как ветчина и лопата,ничего
612,как и ветчина лопата,ничего
613,как ветчина и ветчина лопата,ничего
614,как ветчина ветчина и лопата,ничего
615,как ветчина и лопата,ничего
616,ты знать каков это пребывать в состояние правый,ничего
617,это знать каков ты быть правый,ничего
618,ты знать каков это быть правый,ничего
619,знать обладать познание ты знать каков это быть правый,ничего
620,ты каков знать это быть правый,ничего
621,ты знать это каков быть правый,ничего
622,невиновность ты знать каков это быть правый,ничего
623,ты знать каков это существовать быть иметься правый,ничего
624,ты знать каков это быть пребывать в состояние правый,ничего
625,тяжело это,ничего
626,это тяжело,ничего
627,он право,ничего
628,право он,ничего
629,правовой система он право,ничего
630,он правовой система право,ничего